{
  "artifact_type": "TestCaseRevision",
  "schema_version": "v1",
  "revision_id": "test-case-revision-expense-result",
  "proposal_id": "test-case-proposal-expense-result",
  "change_request_id": "change-request-expense-status",
  "project_id": "visiondemo",
  "source_orchestration_id": "orchestration-expense-status",
  "target_orchestration_id": "orchestration-expense-status-v2",
  "source_test_plan_id": "test-plan-expense-status",
  "target_test_plan_id": "test-plan-expense-status-v2",
  "selections": {},
  "applied_operations": [
    {
      "operation_id": "operation-result-1",
      "test_case_id": "expense-empty-status-api",
      "case_title": "空ステータスで全件を取得する",
      "field": "expected_results",
      "action": "replace",
      "before": "4 件を表示する",
      "after": "5 件を表示する",
      "criterion_id": "criterion-empty-status-count",
      "summary_before": "期待結果：4 件を表示する",
      "summary_after": "期待結果：5 件を表示する"
    }
  ],
  "stale_run_ids": ["test-data-run-expense-v1"],
  "stale_artifact_refs": ["test-plan-expense-status"],
  "stale_evidence_refs": ["evidence-api-expense-status-v1"],
  "stale_closure_result_ids": ["closure-expense-status-v1"],
  "applied_by": "qa@example.invalid"
}
